{
  "schemaVersion": "tf.backend-migration-admission/0.3",
  "state": "frozen-for-independent-review",
  "integrationBaseCommit": "a63415c174dcfaa0dc5370ecc777b6ccdcda86aa",
  "scientificContractBaseCommit": "307e6d723086fe41b6d89e9f9b4b532364ccaeff",
  "previousCandidate": {
    "recordCount": 25,
    "canonicalByteSize": 4209,
    "sha256": "44b1e1d0c9f4208d87faa0b5dae49fa93302ea10217da1e7af59aae8e1e203a5",
    "fullGateInputPathCount": 489,
    "fullGateInputSha256": "f5d3278137026fffe70cbbc9e86ca22e4442bdc6a4c029a0d467086c14970527",
    "approvalTransferred": false
  },
  "previousFinalReview": {
    "path": "evaluation/reviews/2026-09-07-r18a-current-main-execution-v0.1-final-review.json",
    "mode": 420,
    "size": 101840,
    "sha256": "9550a95c54ec4d506a8c26d348a6fe72374041812c038afeb4c391d28603f71f"
  },
  "baseRecords": [
    {
      "path": ".dockerignore",
      "mode": 420,
      "size": 338,
      "sha256": "9d49b6272e10c9c791f6c1288f6df858141bda4613085cc3a811d6edd4aa3ab3"
    },
    {
      "path": ".github/CODEOWNERS",
      "mode": 420,
      "size": 4355,
      "sha256": "6c6d291738c5a6a5f4a0c7f6d03d7a930b5ed02963de2aa7a6c548887d15963c"
    },
    {
      "path": ".github/ISSUE_TEMPLATE/gap.yml",
      "mode": 420,
      "size": 909,
      "sha256": "1bb098efada033d9dc069a8083115488861cc8d4ac24f130d3f7e31b3835c8b1"
    },
    {
      "path": ".github/pull_request_template.md",
      "mode": 420,
      "size": 570,
      "sha256": "ccc7bac029108b664d18031021c9c367bdd9251c71a54c893d534c32b50906a2"
    },
    {
      "path": ".github/workflows/atomistic-bootstrap-verify.yml",
      "mode": 420,
      "size": 11808,
      "sha256": "39a2ebedeaf136b127cb66c20e89f121e211085985b14d3c40fd7dc9eb5626eb"
    },
    {
      "path": ".github/workflows/atomistic-bootstrap.yml",
      "mode": 420,
      "size": 98535,
      "sha256": "e2e05d7e52c9f3ebb67bf067e388382c87d0dc68a7cf54acb4791615bbe8a001"
    },
    {
      "path": ".github/workflows/atomistic-full-candidate.yml",
      "mode": 420,
      "size": 520,
      "sha256": "e578459f2c46e77d10f3fd944984daa01f845219921454c3095b9852e4074cc0"
    },
    {
      "path": ".github/workflows/comparator-refresh.yml",
      "mode": 420,
      "size": 1405,
      "sha256": "abf1f3672af5515241eaa76818fef9be182efb062c9d7c7ea7f8772cbf4dd986"
    },
    {
      "path": ".github/workflows/evaluate.yml",
      "mode": 420,
      "size": 4282,
      "sha256": "57773b8ff757a5c3401bdaa8878bb43a6386921a7af351f0e5c1a5173e65a5d1"
    },
    {
      "path": ".github/workflows/openmm-tip3p-protected.yml",
      "mode": 420,
      "size": 68552,
      "sha256": "1e709fd989d30908df269ed236af00b7d94f3b77e8945cccdb3f45622bf87810"
    },
    {
      "path": ".github/workflows/sentinel-report.yml",
      "mode": 420,
      "size": 27294,
      "sha256": "9d07ad91f474da47ce1b7367cd25dbb3e13c6c95021a05ff38278a12e2368c4d"
    },
    {
      "path": ".gitignore",
      "mode": 420,
      "size": 478,
      "sha256": "db60593548fb82833134148fefb780591e1e6dd8882b31cc0076d37572b0ca28"
    },
    {
      "path": ".openai/hosting.json",
      "mode": 420,
      "size": 31,
      "sha256": "d532abb65cf9ae20634b464d954cb4a08a0de9f3cd3cdf7f9c3ec8948826d947"
    },
    {
      "path": "README.md",
      "mode": 420,
      "size": 23197,
      "sha256": "ab99c4b19d139231bcec73499353661aa956bdcc0077f392fa373fa43d108621"
    },
    {
      "path": "app/components/aqueous-dynamics-lab.tsx",
      "mode": 420,
      "size": 24832,
      "sha256": "a8bd960ab56d4788a75ae4a218ff6038b561455bdfdf4addc34b1d55306c63f9"
    },
    {
      "path": "app/components/aqueous-dynamics-webgl.tsx",
      "mode": 420,
      "size": 30828,
      "sha256": "9368a465d7f1754e099f3dbda6ad0628ad3bd471af7b5504230dcbe83ebe42c3"
    },
    {
      "path": "app/components/custom-structure-webgl.tsx",
      "mode": 420,
      "size": 19214,
      "sha256": "88db9dd77af3c756e79c1e72f817984ea14fb4e0d70ca52bb945f3a4aacdaaaa"
    },
    {
      "path": "app/components/custom-structure-workbench.tsx",
      "mode": 420,
      "size": 31775,
      "sha256": "8789b04d18db21d929ce818034de2974c49245a6f5efc3c1711702441b6a3f7e"
    },
    {
      "path": "app/components/molecular-canvas.tsx",
      "mode": 420,
      "size": 30430,
      "sha256": "e4d1aa219e895a8fe3e050c529a0f95791406ae6fd3c0614665d14efcf74006f"
    },
    {
      "path": "app/components/molecular-lab.tsx",
      "mode": 420,
      "size": 56179,
      "sha256": "0aad0c089905e0425c5580335f9205d6cccbc523ba19b87ad1c998b057a27798"
    },
    {
      "path": "app/components/molecular-visual-guides.test.ts",
      "mode": 420,
      "size": 5969,
      "sha256": "0c45dd8fc690d4bbfa44d210c085d959a01718a60773220b7c6a925bab16186f"
    },
    {
      "path": "app/components/molecular-visual-guides.ts",
      "mode": 420,
      "size": 9191,
      "sha256": "939babc3fb0eeacd99c8d041c6551d68a6010a77c4482dd89e88067cc80091a1"
    },
    {
      "path": "app/components/periodic-atomistic-canvas.tsx",
      "mode": 420,
      "size": 17038,
      "sha256": "d70ffd424ba204b44856a6b0d4645a0c1a6831b415e5f7cd7c86bd2fc4df05c6"
    },
    {
      "path": "app/components/periodic-atomistic-lab.tsx",
      "mode": 420,
      "size": 15145,
      "sha256": "4e6825dfa8885f303686e0905f27abf2d9e69c1b80b2fc971a0eacd9ea26aede"
    },
    {
      "path": "app/globals.css",
      "mode": 420,
      "size": 131152,
      "sha256": "e8ba938bde0529b37b6870b2f75aa4cdaa9e0f4c3509fd9a2e51113b80883708"
    },
    {
      "path": "app/icon.svg",
      "mode": 420,
      "size": 426,
      "sha256": "5288615b4c7fbb4a10479cfccf92cc2172d1b11fbd7a9c7184c4c86bbdea394e"
    },
    {
      "path": "app/layout.tsx",
      "mode": 420,
      "size": 1224,
      "sha256": "b32ab07743fb667a33818f6107f335b436bce408cb3051f53a9873a53bebf932"
    },
    {
      "path": "app/page.tsx",
      "mode": 420,
      "size": 67719,
      "sha256": "a24618209e79d40f32b2d96b0cccf3c96938096cf72794557ffa3777c14ef176"
    },
    {
      "path": "atomistic/containers/README.md",
      "mode": 420,
      "size": 5806,
      "sha256": "fd21f13debde87f13e382c4111c241e629702db9681b20411ea3b5310cfdde24"
    },
    {
      "path": "atomistic/containers/mace.Dockerfile",
      "mode": 420,
      "size": 3338,
      "sha256": "d97f48e8d8d75c2b4d22acf46ec5aa7ba21cb2acd59db7a4745e2021f4438b5f"
    },
    {
      "path": "atomistic/containers/mattersim.Dockerfile",
      "mode": 420,
      "size": 3533,
      "sha256": "d672230adbc540391e8be4424aca24c50e473ca46a5a244d06838f55cc288455"
    },
    {
      "path": "atomistic/containers/openmm-water.Dockerfile",
      "mode": 420,
      "size": 5507,
      "sha256": "939e5358108493c6b0e03f2f177a3de88bbe0d8e013d1d615a52d27a6f185884"
    },
    {
      "path": "atomistic/containers/openmm-water.Dockerfile.dockerignore",
      "mode": 420,
      "size": 534,
      "sha256": "1a30b44539518f67e8c6ebd6ad4f5cacc01f094da57d139b7269dff07ea4aeb8"
    },
    {
      "path": "atomistic/locks/README.md",
      "mode": 420,
      "size": 9522,
      "sha256": "65abe1d5c48185090a1b1a96cfa813f3b8eb88a25cf10f59798798db5ae36a03"
    },
    {
      "path": "atomistic/locks/mace.bootstrap.in",
      "mode": 420,
      "size": 460,
      "sha256": "8cf1b3fbed74c0f9f6f0ff070f4189c0280f87a39762cf611cd69c7166adc2cb"
    },
    {
      "path": "atomistic/locks/mace.requirements.lock",
      "mode": 420,
      "size": 4612,
      "sha256": "ae4b21b6f6d8ad98edcf2d5e0d938cd563379f494cce0b4aaa2e987332147e33"
    },
    {
      "path": "atomistic/locks/mattersim.bootstrap.in",
      "mode": 420,
      "size": 887,
      "sha256": "4ac7c003925368ca75c125b768720ff622b873513b765bf98fcc703a6c6654a6"
    },
    {
      "path": "atomistic/locks/mattersim.requirements.lock",
      "mode": 420,
      "size": 16233,
      "sha256": "9c990909d1307bb32608d31b9ed217d2368c28e2048f6dec39e8dc4a2b63642b"
    },
    {
      "path": "atomistic/locks/openmm-water.requirements.lock",
      "mode": 420,
      "size": 494,
      "sha256": "0ac51574b68c86046254d37bb73a57e3104d6ffec1c3f98b07a8593dcb546c6b"
    },
    {
      "path": "atomistic/locks/python-hostlist-build.requirements.lock",
      "mode": 420,
      "size": 362,
      "sha256": "dffc06ecc2faab2b6e0fe729ac1c16dda524edff76297a06e20b839832e1e120"
    },
    {
      "path": "docs/ARCHITECTURE.md",
      "mode": 420,
      "size": 32449,
      "sha256": "61931114b38da4200d9ca8e75401b138956c589a36f90d55fe2a39efa475f2b4"
    },
    {
      "path": "docs/ATOMISTIC_REPRODUCTION.md",
      "mode": 420,
      "size": 40982,
      "sha256": "86f6e88c1807bd8daa8b63b9969789695090464f932f5b5caf233efdf7df7767"
    },
    {
      "path": "docs/EVALUATION_LOOP.md",
      "mode": 420,
      "size": 12322,
      "sha256": "1522b917022933106a4a78f6d6fb74a1731afe8787da5effdd3dd619ee5f74f5"
    },
    {
      "path": "docs/MOLECULAR_DYNAMICS.md",
      "mode": 420,
      "size": 21957,
      "sha256": "38b3a6048e6b6358a627393c2106ba99eb53459c919797e48b89c03f47e5f923"
    },
    {
      "path": "docs/NACL_WATER_INTERFACE_V0410_CONTRACT.md",
      "mode": 420,
      "size": 15146,
      "sha256": "f884d5a1f491e3bd5b61b1075b8b4b8e4433fe50f48db4963293ef7389f2b3e6"
    },
    {
      "path": "docs/NACL_WATER_INTERFACE_V0411_IMPORT_CONTRACT.md",
      "mode": 420,
      "size": 8116,
      "sha256": "c5b68a8ca7ca1950c397eaa19e21e7cf1790a0c96ebcd4290220c3886ffd2f06"
    },
    {
      "path": "docs/NACL_WATER_V042_CONTRACT.md",
      "mode": 420,
      "size": 16030,
      "sha256": "1c876526ea68c00ba23407a04b4fb2af7e4ab8da3c6b8375bc5325edf6f991d0"
    },
    {
      "path": "docs/RESEARCH_BASELINE.md",
      "mode": 420,
      "size": 13986,
      "sha256": "ca8f3339065737a34d6faa5f4600b5bb6077ecd86634eddffe61b8a022ec94e4"
    },
    {
      "path": "docs/ROADMAP.md",
      "mode": 420,
      "size": 4062,
      "sha256": "a5a7a472e749ad0bf6086230891f5b7d5c720cb48177d8cdef0e0d8ebe0ee7d9"
    },
    {